timestamp,cast_hash,text,world,window,likes,recasts,replies,score
,0xa4c9bd22812b0d569cda763a32f31a8e0c9927ff,Half the industry runs on unpaid optimism.,art,wrap_convo_chaos,2,1,0,4
,0x2f0199132a0107b651ab257c7dd7f67d548f5b57,"Design should feel like tuning a car — mechanical, deliberate, alive.",cars,process_flex,2,0,0,2
,0x50ed25e4a8413509e13e586f4e9b9bcbf09e8012,Revision gets treated like an afterthought. But that’s where writing might actually happen.,table,process_flex,1,0,0,1
,0xcbec09972ff771703d7ba951dcc9e275f95e2158,Note to self: Eat without YouTube.,note_to_self,wake_bait,4,0,0,4
,0x043ec0edc3e8811d0630380607ebeac666b38c0b,Turns out silence has better conversion rates.,,,2,0,0,2
,0x3614a1efd24d79211898e17422c4b0e9543ffc42,Every project is a prototype for how I want to live.,cobalt,wrap_convo_chaos,1,0,0,1
2025-10-22T18:27:00.395093,0x920d225db14284f09ea9dc7d7a056908e8e27b21,I don’t want another blog. I want a place where old thoughts can come back wearing new clothes.,table,wrap_convo_chaos,1,0,0,1
2025-10-22T18:58:03.850591,0xa093ad2ae4a4028b10bebd8e9283e53f49b74d50,Someday I’ll build a place where stories can breathe between versions.,table,wrap_convo_chaos,0,0,0,0
